{
  "schema_version": "cavra.community_maintenance_release.v1",
  "packet_id": "community-v0.1.2-maintenance-verification",
  "release_name": "CAVRA Community v0.1.2",
  "release_state": "ready_with_accepted_risk",
  "prepared_at": "2026-06-04T00:00:00Z",
  "repository": "Huzefaaa2/cavra",
  "tag": "community-v0.1.2",
  "version": "0.1.2",
  "release_url": "https://github.com/Huzefaaa2/cavra/releases/tag/community-v0.1.2",
  "release_notes": "docs/releases/community-v0.1.2.md",
  "verification_packet": "docs/release-verifications/community-v0.1.2-maintenance-verification.md",
  "verification_workflow": "https://github.com/Huzefaaa2/cavra/actions/workflows/verify-community-release.yml",
  "gates": [
    {
      "name": "Release notes",
      "status": "pass",
      "evidence": "docs/releases/community-v0.1.2.md",
      "owner": "release-agent",
      "notes": "Dry-run maintenance release notes are present and linked."
    },
    {
      "name": "Changelog",
      "status": "pass",
      "evidence": "CHANGELOG.md",
      "owner": "release-agent",
      "notes": "Changelog records the v0.1.2 dry-run release-notes and verification packet."
    },
    {
      "name": "README link",
      "status": "pass",
      "evidence": "README.md",
      "owner": "docs-agent",
      "notes": "README links the v0.1.2 dry-run release notes and verification packet."
    },
    {
      "name": "Wiki link",
      "status": "pass",
      "evidence": "docs/wiki/Home.md",
      "owner": "docs-agent",
      "notes": "Wiki-ready navigation links v0.1.2 release notes and verification pages."
    },
    {
      "name": "Verification workflow",
      "status": "pass",
      "evidence": ".github/workflows/verify-community-release.yml",
      "owner": "release-agent",
      "notes": "Manual verification workflow remains available for the eventual published v0.1.2 artifacts."
    },
    {
      "name": "Artifact checksums",
      "status": "warn",
      "evidence": "pending real community-v0.1.2 GitHub Release artifacts",
      "owner": "release-agent",
      "notes": "Dry-run packet does not claim wheel or source distribution checksums."
    },
    {
      "name": "Install smoke",
      "status": "warn",
      "evidence": "pending real cavra-0.1.2 wheel",
      "owner": "test-agent",
      "notes": "Clean install smoke is deferred until v0.1.2 artifacts exist."
    },
    {
      "name": "Public boundary",
      "status": "pass",
      "evidence": "bash scripts/validate-boundaries.sh .",
      "owner": "security-agent",
      "notes": "Public boundary validation covers this dry-run packet."
    },
    {
      "name": "CI evidence",
      "status": "pass",
      "evidence": "Community CI, package metadata validation, and workflow guard tests",
      "owner": "release-agent",
      "notes": "Required checks validate package metadata closure and release workflow guard evidence."
    }
  ],
  "validation_commands": [
    {
      "command": "python3 scripts/validate-python-package-metadata.py",
      "status": "pass",
      "output_reference": "CAVRA Python package metadata validation passed."
    },
    {
      "command": "python3 -m pytest tests/test_package_metadata.py tests/test_ci_templates.py -q",
      "status": "pass",
      "output_reference": "Package metadata and workflow guard tests passed."
    },
    {
      "command": "python3 scripts/validate-maintenance-release-evidence.py",
      "status": "pass",
      "output_reference": "CAVRA maintenance release evidence validation passed."
    },
    {
      "command": "python3 scripts/validate-community-release-note-freshness.py",
      "status": "pass",
      "output_reference": "CAVRA Community release note freshness validation passed."
    },
    {
      "command": "bash scripts/validate-boundaries.sh .",
      "status": "pass",
      "output_reference": "CAVRA public boundary validation passed."
    }
  ],
  "accepted_risks": [
    {
      "risk": "Dry-run packet does not include real v0.1.2 release artifacts, checksums, or clean-install smoke evidence.",
      "severity": "low",
      "owner": "release-agent",
      "expiry": "2026-06-18",
      "compensating_control": "The packet is explicitly marked as dry-run and blocked from official publication until artifacts are built, checksummed, published, and smoke-tested.",
      "decision": "accepted"
    }
  ],
  "public_boundary": {
    "enterprise_source_included": false,
    "paid_policy_packs_included": false,
    "customer_records_included": false,
    "private_keys_included": false,
    "private_registry_credentials_included": false,
    "validation_result": "pass"
  },
  "decision": {
    "status": "defer",
    "rationale": "The Community v0.1.2 release notes and dry-run verification packet are ready for review, but official publication is deferred until maintainer approval and real artifact publication."
  },
  "next_recommendation": "Convert Community v0.1.2 dry-run into an official maintenance release after maintainer approval and artifact publication."
}
